text,coarse label
Hur mycket Coca Cola dricks på en dag i världen?,NUM
Namnge trädodlingsföretaget.,HUM
Vilken är Dr Seuss mest populära bok?,ENTY
Hur påverkar matfärgen hur du tror att den kommer att smaka?,DESC
Var kom världen ifrån?,LOC
Vad betyder verdandi?,DESC
Vilket djur åt bröd och ostron med en snickare?,ENTY
Vilken ögrupp är Guadalcanal en del av?,LOC
"Vem förklarade: ""Jag tror att jag går ut och mjölkar älgen""?",HUM
"Vad är ursprunget till ""grill""?",DESC
Hur rengör du dåligt lackerad mässing?,DESC
Hur många e-handelsföretag startas varje dag?,NUM
Hur kan du definiera tid?,DESC
Vad är det enda östeuropeiska landet som inte är bundet till rubeln?,LOC
Vad är Judy Garlands födelsedatum?,NUM
Vad står HIV för?,ABBR
Vad är Shirley MacLaine känd som?,ENTY
Hur tillverkas plast?,DESC
Vilka är de sju principerna för lärande från Institute for Research on Learning| IRL?,ENTY
Vilken bok arbetade F. Scott Fitzgerald på när han dog i Hollywood 194?,ENTY
Hur har myror sex?,DESC
Vilken tidigare Ku Klux Klan-medlem vann ett ämbete i USA?,HUM
Hur lång är gränsen mellan Ukraina och Ryssland?,NUM
Vad är HDLC?,ABBR
Vad går med vitt vin för att lägga spritz i en Spritzer?,ENTY
Vad är en nematod?,DESC
"Vad är innebörden av ""HLR""?",DESC
Vilken färg har sju av 10 hus i USA?,ENTY
Vad fruktar en fobofob?,ENTY
Vad är kapitalism enligt Max Weber?,DESC
Vilket land har den högsta mordbrandsatsen?,LOC
Vilka färger på bönor vägrade de forntida romarna att äta?,ENTY
Vad använder seglare för att mäta tid?,ENTY
Vem var skådespelaren som spelade Sam i filmen Casablanca?,HUM
Vilken stad betjänas av Orly Airport?,LOC
Var skedde Woodstock?,LOC
Vilken är den mest populära spelformen bland kvinnor i Las Vegas?,ENTY
Vilken uppgift utför Bouvier-hundrasen?,HUM
Vad är den genomsnittliga tiden att kyssa någon?,NUM
Vilka är de fem mest oljeproducerande länderna i världen?,LOC
"Vilken New Orleans DA hävdade: ""Min personal och jag löste mordet för flera veckor sedan""?",HUM
Var kan man hitta Rider College?,LOC
Hur mycket koffein är i en 16 oz kopp kaffe?,NUM
Varför innehåller haven saltvatten istället för sötvatten?,DESC
Vad är Bella Abzugs varumärke?,ENTY
Vad var det riktiga namnet på författaren Ross Macdonald| skaparen av hjälten Lew Archer?,HUM
Vilken spindel gör ett fantastiskt husdjur| till och med sagt att den kan känna igen sin herre?,ENTY
Vad betyder ordet affiant?,DESC
Vilka fordon körs i Tour de France?,ENTY
Hur stort är Australien?,NUM
Vad krävs för att vara en hjälte?,ENTY
Hur skriver de kinesiska tecken på ett tangentbord?,DESC
Vilket djur orsakar det största hotet mot människor?,ENTY
Vad är en rädsla för förstörelse?,ENTY
Vilka länder har flest bilstölder?,LOC
"Vem gör kyckling ""finger lickin"" bra?",HUM
Vilken regissör skildrade befälhavaren för krigsfångalägret i Stalag 17 1953?,HUM
Vad heter Jacques Cousteaus två söner?,HUM
Vilka brittiska TV-serier inspirerade All in the Family?,ENTY
Vad betyder ordet terrorism?,DESC
Vem följde med Space Ghost på hans uppdrag?,HUM
Vad betyder N est-ce pas?,DESC
Namnge de fem orden som använder alla bokstäver i alfabetet| förutom Q| utan upprepningar.,ENTY
"Vad är ursprunget till ordet ""tampong""?",DESC
"Vilken andra världskrigets ledare förklarade: ""Slaget har slagits""?",HUM
Hur kan jag få ett CCT-diagram?,DESC
Vem var Israels första premiärminister?,HUM
Vilken är den mest populära sportbilenfärgen?,ENTY
Vilket land skryter med Ismails palats och kung Farouks palats?,LOC
Vilken Broadway-show introducerade låten Some Enchanted Evening?,ENTY
Vad är ett växttillskott?,DESC
Var skulle jag kunna åka på ett ånglok?,LOC
Vilken produkt upptäckte och producerade William Horlick?,ENTY
När Adam Strange inte äventyrar på Rann| vad kallar Adam Strange sitt yrke?,HUM
Hur gör man en bibliografisida?,DESC
Vilket yrke har den högsta skilsmässoprocenten?,HUM
Vilken dryck innehåller så många typer av rom som möjligt?,ENTY
Var finns referensen till Virtual Desk?,LOC
Hur högt är åska?,NUM
"Vilken Kaliforniens guvernör sa: ""Handlingslöshet kan vara den högsta handlingsformen""?",HUM
Vad är en ekologisk nisch?,DESC
Vem är Desmond Tutu?,HUM
Vem var den första personen att studera stjärnorna?,HUM
Var kom termen eldstift ifrån?,DESC
Vilken ansiktsdetalj sportade Walt Disney som ingen av Disneys anställda fick?,DESC
"Vem är författaren till boken ""The Iron Lady: A Biography of Margaret Thatcher""?",HUM
Vilka är de 10 högsta högskolorna i USA inom teknikområdet?,HUM
Hur mycket skulle en svartvit 1-cent-frimärke vara värd| Thomas Jefferson på den?,NUM
Vad är sannolikheten för att minst 2 av 25 personer ska ha samma födelsedag?,NUM
Var är bron över floden Kwai?,LOC
Hur kan uttagsautomater veta om din dollar är en 1 eller 5?,DESC
Hur många människor åtog sig FN att hjälpa till med för att återställa ordningen och distribuera humanitär hjälp i Somalia i september 1992?,NUM
Hur många elefanter finns kvar på jorden?,NUM
Vad är en softball gjord av?,ENTY
"Vilken ""lilla röda bil"" nämns i popsångaren Prince's hitlåt?",ENTY
"Vem menade Doris Day när hon sa: ""Jag kallar honom Ernie för han är verkligen ingen rock""?",HUM
"Vilken typ av art är monstret i filmen ""Jaws""?",ENTY
När marknadsfördes den första praktiska kommersiella skrivmaskinen?,NUM
Vad är en torka?,DESC
Vilka är fördelarna med hemmaskolan?,DESC
Vilket skandinaviskt land täcker 173732 kvadratmil?,LOC
Vilken är den mest sålda boken genom tiderna?,ENTY
Vad har Hank Aaron| Jimmy Stewart och Howard K. Smith gemensamt?,DESC
Vilka är de första sex orden i Dickens A Tale of Two Cities?,ENTY
Hur lång tid skulle det ta att ta sig från jorden till Mars?,NUM
Var kan jag få e-postlistor?,LOC
Vilken stad har Billingsgate fiskmarknad?,LOC
Vem är ägaren till CNN?,HUM
Hur lång var OJ Simpson-rättegången?,NUM
Vilket land ligger direkt söder om Detroit?,LOC
Var har surfing sitt ursprung?,LOC
Varför kallades Henry Fords första bilmodell T & hans andra biltyp| introducerad 1928| modell A?,DESC
Hur skär företag papper så tunt?,DESC
Vad är det högsta berget?,LOC
"Vilken är ""datorn för resten av oss""?",DESC
Vilken kärnprocess sker i en H-bomb?,DESC
Vad är det maximala antalet klubbor som en golfare får använda i en omgång?,NUM
Vilken kortfärg representerade ursprungligen bondeklassen?,ENTY
Vad är det ungerska ordet för peppar?,ENTY
Vad tillverkar Peugeot-företaget?,ENTY
Hur många olika länder exporterar kaffe?,NUM
Vad är en rädsla för allt?,ENTY
Hur många kontinenter finns det?,NUM
"Vilken majonnäs hänvisar till sig själv som ""riktig"" majonnäs?",ENTY
Vad är kontorsautomation?,DESC
Vilket instrument spelar Benny Carter?,ENTY
Vilken riddarskådespelare är berättarrösten till TV:s The World at War?,HUM
Vilka matredskap används för handikappade barn?,ENTY
Vilken fotbollstränares historia berättades i filmen Run to Daylight?,HUM
Vilka företag i Alaska påverkades av Exxon Valdez oljeutsläpp?,HUM
Vad meddelar Lloyds Lutine Bell?,DESC
När inträffade kärnkraftsolyckan i Tjernobyl?,NUM
Var bodde mayafolket?,LOC
Vad summerar motsatta ansikten på en tärning alltid?,ENTY
Vad hette Randy Crafts advokat?,HUM
"Vad är ""kattfeber""?",DESC
Kosovo är en provins i vilket land?,LOC
Vilken New England stat täcker 5|9 kvadratkilometer?,LOC
Vad är förkortningen för Original Equipment Manufacturer?,ABBR
Hitler kom till makten i Tyskland under vilket år?,NUM
Vem marknadsför Spaghetti-o?,HUM
Vad kallade antikens folk de fyra stora elementen?,ENTY
Var ligger de haversianska kanalerna?,LOC
Vilket djurs svans kallas en borste?,ENTY
Hur många människor dör av tuberkulos varje år?,NUM
Vad hette de tre fartygen som användes av Columbus?,ENTY
Vem spelade tillsammans med Julie Andrews i Mary Poppins?,HUM
Var hittar jag statusen för min självdeklaration?,LOC
Vad är hästkrafterna hos skyttelboostrarna?,NUM
Vad förväntas välta mellan 2010 och 2020?,ENTY
Hur gör getingar sina bon?,DESC
När kastades general Manuel Noriega ut som ledare för Panama och överlämnades till amerikanska myndigheter?,NUM
Hur många år av otur följer av att bryta en spegel?,NUM
Vilka typer av kristaller finns?,ENTY
Vilket är det bästa öppningsdraget i schack?,ENTY
Vad äter nyckelpigor?,ENTY
Vem var Ezra Taft Benson?,HUM
Vad är Taj Majal gjort av?,ENTY
Var ligger Kentucky Horse Park?,LOC
Vilken argentinsk boxare dödades utanför en bordell i Nevada i maj?,HUM
Vilket land har flest bilar per mil väg?,LOC
Varför har en munk ett hål i sig?,DESC
Vad hände med Pompeji?,DESC
Vad sätter en hovslagare skor på?,ENTY
Namnge ett Sioux-språk.,ENTY
Vad består saliv av?,ENTY
Vad är Jimmy Olsens fullständiga namn?,HUM
Hur många människor har dött av tuberkulos?,NUM
Vad är ett annat namn för närsynthet?,ENTY
Hur många dagar lever en typisk fluga?,NUM
"Vilken berömd borgmästare i New York skrev hitlåten ""Kommer du att älska mig i december som du gör i maj?",HUM
Vilken rysk stad kallades tidigare St Petersburg och Petrograd?,LOC
Vad är definitionen av en häxa?,DESC
Vad är kakor på Internet?,DESC
Hur många röster i kongressen avstod från krigsförklaringen 1941 med Japan?,NUM
Vem är Pia Zadoras miljonär make och mentor?,HUM
Vilken amerikansk president var den första som födde upp mulor?,HUM
Vad är skillnaden mellan molekyler och föreningar?,DESC
Vilken astronomarkitekt designade den nuvarande St. Paul's Cathedral i London?,HUM
Varför är så många paraplyer svarta?,DESC
Vilken feminist skrev Sexual Politics and Flying?,HUM
Vem var den första amerikanska schackmästaren?,HUM
Vad är stjärntecknet för 14 augusti?,ENTY
Vem var den sista kvinnan som avrättades i England?,HUM
Hur många skolområden finns det i USA?,NUM
Hur länge höll pariskommunen ut mot resten av Frankrike?,NUM
Vilket universitetsfotbollslag tog OJ Simpson till Rose Bowl?,HUM
Vad står snafu för?,ABBR
Vilken färg är Chablis?,ENTY
Vilket NFL-team avslutade Vince Lombardi sin tränarkarriär med?,HUM
Hur mycket järn finns det i din kropp?,NUM
Vad är skillnaden mellan fatalism och determinism?,DESC
När blev Thatcher premiärminister?,NUM
Vilka är några bra fraktala webbplatser?,LOC
Vilket land införde Berlinblockaden 1948?,LOC
Vilken framtida filmgodis introducerades för amerikanska kolonister 1603 av indianer?,ENTY
Hur tar kameror bilder?,DESC
Hur mycket kostar läkemedlen för att behandla tuberkulos?,NUM
Vem är prins Naseem Hamed?,HUM
Vilken typ av livsmiljö bor skorpionen i?,LOC
Hur många logaritmiska skalor finns det på en glidlinjal?,NUM
Var ligger Webster University?,LOC
Vilken sporttidning har den största upplagan?,ENTY
Vad är den lagliga alkoholgränsen för delstaten Kalifornien?,ENTY
Hur varm ska ugnen vara när du gör Peachy Oat Muffins?,NUM
Hur gammal är Britney Spears?,NUM
Var kan jag få pianomusik till Jamiroquai-låten Everyday for the midi?,LOC
Varför är Microsofts Windows 3 ett så framgångsrikt datorprogram?,DESC
Vilket lands huvudstad bildades när Pesth och Buda slogs samman?,LOC
Vad är ursprunget till den amerikanska arméns sergentband?,DESC
Vad handlar proposition 98 om?,DESC
Vilken stad var scenen för The Music Man?,LOC
Vad fiskade Simple Simon efter i sin mors hink?,ENTY
Vad kallade Woody Allen den japanska gangsterfilmen han dubbade till engelska som en komedi?,ENTY
Varför slocknar ett ljus när vi blåser på det?,DESC
Vilken titel gör komikern Henry Youngman anspråk på?,HUM
"Vad är ""smaken som slår de andra kalla""?",ENTY
Vem gjorde det första flygplanet som kunde flyga?,HUM
Vilken typ av sport spelade de under åren 1642-1649| den engelska inbördeskrigstiden?,ENTY
"Var kan jag hitta vetenskapliga data| ""forskningspapper"" om textilteknik?",LOC
Vad skapar salt?,DESC
Hur många människor dör av ormbettförgiftning i USA per år?,NUM
Hur hög är staden Denver?,NUM
Vem var Internationella olympiska kommitténs ordförande vid sommarspelen 1936?,HUM
När antogs Florida in i unionen?,NUM
Vilket företag har byggt mer än 2|5 miljarder små växthus sedan 1935?,HUM
Hur många gånger om året publicerar American Gourd Society The Gourd?,NUM
Var kan jag läsa om Abraham Lincoln?,LOC
Vad kommer ökningen av gasavgiften i Kalifornien att bli år 2000?,NUM
Hur långt är det längsta hål-i-ett 1 på någon golfbana och var hände det?,NUM
"Vilken whisky är ""känt för sällspaket det håller""?",ENTY
Vilken utnämningssekreterare för Richard Nixon satt i fängelse?,HUM
Vem släppte internetmasken i slutet av 1980-talet?,HUM
Vad heter amerikanen som fångades när hans flygplan gick ner över Syrien-hållna Libanon?,HUM
"Var kommer uttrycket ""moln nio"" ifrån?",DESC
Vad är lungcancer?,DESC
Vilken skola går Tom på i Tom Browns skoldagar?,HUM
Vilken basketspelare är krediterad med 23924 returer?,HUM
Hur stor är en normalstor penis för en 15-åring?,NUM
"Vad kallar Playboy sin ""fortsatta dialog om samtida frågor mellan Playboy och dess läsare""?",ENTY
Hur många amerikanska soldater förblir oberäknade från Vietnamkriget?,NUM
Var kan jag hitta ett band eller en bok som hjälper mig att prata| skriva och förstå japanska?,LOC
Hur många kablar stöder huvudspannet av Golden Gate Bridge?,NUM
Hur mycket spenderade Manchester United på spelare år 1993?,NUM
Vad var födelseplatsen för Edgar Allen Poe?,LOC
Varför avbröts röda M&Ms och togs sedan tillbaka?,DESC
Vad krävs för att bli en advokat?,ENTY
Vilken amerikansk sergeant förlorade båda händerna i strid under andra världskriget och fortsatte sedan att spela i en enda film som han vann två Oscar för?,HUM
Vem uppfann fontänen?,HUM
Vilket rum hade WC Fields sitt bibliotek i?,LOC
Vad orsakar en jordbävning?,DESC
Vilken Batman-karaktär åker runt på en Batcykel?,HUM
Vilka är de viktigaste blodkärlen?,ENTY
"Vad betyder ""saute""?",DESC
Var kan jag hitta ritningarna till vindrutetorkningsmekanismen?,LOC
Vilken typ är en snigel?,ENTY
Vem var Sherlock Holmes ärkefiende?,HUM
"Var ligger ""Global Schoolhouse""?",LOC
Hur många år av skolning efter gymnasiet tar det för att bli neurokirurg?,NUM
Vilka är de bästa grönsaksgrödorna i världen?,ENTY
Vilken vulkan regnar aska på Sicilien?,LOC
Var ligger det amerikanska huvudkontoret för Procter & Gamble?,LOC
Varför trodde aztekerna först att spaniorerna var gudar?,DESC
"Vad är reglerna för ""snögolf""?",DESC
Vad kallar Warner Bros. en flyglös gök?,ENTY
När hade Mount St. Helen senast ett stort utbrott?,NUM
"Hur säger man ""äta dagen"" på latin?",ENTY
Vad är superbollar gjorda av?,ENTY
Vad heter Tom Sawyers moster som han bor med?,HUM
Vilken är den snabbast växande serietidningen genom tiderna?,ENTY
Vilken medlem av Micronauts tillbringade 1 år på att resa Microverse i Marvel-serierna?,HUM
Vilken läkare hävdade i en bok från 1946: ”Det finns inget som heter en dålig pojke”?,HUM
Hur länge har LL Cool J. varit gift?,NUM
Hur mycket vägde en riddares rustning?,NUM
Vilken komiker skapade en punch-drunk pugilist vid namn Cauliflower McPugg?,HUM
Vilken är filmen om Jonathan Livingstone Seagull?,ENTY
Hur lång är prins Charles?,NUM
Vad är luftens vikt?,NUM
Vad är en rädsla för barn?,ENTY
Vad är ouzo?,DESC
Vilket lopp är 1137 miles lång?,ENTY
Vad är Uruguays huvudstad?,LOC
Vad står TS för i TS Eliots namn?,ABBR
Hur långt är världens största fartyg| i meter?,NUM
Vem är William Wordsworth?,HUM
Vad är det att älska?,DESC
Vem är Charles Lindbergh?,HUM
Hur hög är kopian av Matterhorn i Disneyland?,NUM
Vilka är de största öknarna i världen?,LOC
Var ligger Qatar?,LOC
Varför är jordnötssmörkakor toppade med korsningar?,DESC
Vilken är den rikaste staten i USA?,LOC
Vem är premiärministern i Norge?,HUM
Vad är en urolog?,DESC
"Vilken skådespelerska spelade i ""The Lion in Winter""?",HUM
Vad flaskas i jeroboams?,ENTY
Vem vann VM i rugby?,HUM
Vad är Nicholas Cages yrke?,HUM
Hur många gånger var kastaren| Warren Spahn| en 20-match-vinnare under sina 21 major league säsonger?,NUM
Hur många stift används i käglor?,NUM
Vilka kvalifikationer finns det för individer som donerar blod?,DESC
Vilken bro i Kalifornien var Don Brown den första som korsade den 27 maj 1937?,LOC
Vem är den berömda systern till skådespelerskan Olivia De Havilland?,HUM
Vilken tysk president pressades att utnämna Hitler till kansler 1933?,HUM
Hur många människor har dödats i krig| väpnade konflikter?,NUM
Vad är hårtorkens historia?,DESC
Vilket däggdjur lever| föder upp| äter och sover under jorden?,ENTY
Vilken handel hoppades portugiserna på 1400- och 1500-talet att kontrollera mellan Asien och Europa?,ENTY
Vad hände i staden Dogtown 1899?,DESC
Vilken var den största staden i världen som förklarade krigslag 1989?,LOC
Vad är en rädsla för att synda?,ENTY
Var ligger Thomas Edison Museum?,LOC
Vad var den första minimilönen?,NUM
Vad heter Afrikas högsta berg?,LOC
Vilket bergskedja sträcker sig från St.Lawrencebukten till Alabama?,LOC
Hur många typer av lemurer finns det?,NUM
Vilka är några färgglada blommor som blommar på hösten i New England?,ENTY
Vad är det näst mest använda mordvapnet i USA?,ENTY
Vilka företag eller byråer skulle göra en verifieringsanställning?,HUM
"Vilken berömd tränare sa """"om du inte kan slå dem i gränden| kan du inte slå dem på isen""""?",HUM
"Vilken engångsmedlem i Ronald Reagans kabinett kallade federal politik gentemot indianer ""ett exempel på socialismens misslyckande""?",HUM
Hur många klor har en hummer som kallas en pistol förlorat?,NUM
Vem var Darth Vaders son?,HUM
Vilka är de fyra mest använda språken i Nordamerika?,ENTY
Vilket krig utkämpades av spaniorerna så långt som till Filippinerna?,ENTY
Hur tjänar man en miljon dollar?,DESC
Vem uppfann processen för att tillverka kondenserad mjölk?,HUM
Vilken är den största staden i Connecticut?,LOC
Vad är befolkningen i USA?,NUM
Vilken skådespelare och skådespelerska har gjort flest filmer?,HUM
Vad är definitionen av skräppost?,DESC
Vem hittade Hawaii?,HUM
Vad står IQ för?,ABBR
Var hittar jag gratis pianonoter för populärmusik?,LOC
När slutade det amerikanska inbördeskriget?,NUM
Vilket land är den största diamantproducenten?,LOC
Hur lång tid tar det månen att kretsa runt jorden?,NUM
"Vilken öl är 'rockin' America? """,ENTY
Vad är en fruktan för kvinnor?,ENTY
Vem skyddar DC Comics drömvärld?,HUM
Vad heter dinosaurie-avfall?,ENTY
Vad var den ökända prestationen av Tysklands U-2 ubåt?,DESC
Vilken homerisk epos berättar om händelserna mot slutet av Trojan Wars?,ENTY
När utbröt vesuvius senast?,NUM
Vad används ofta för att upptäcka fosterskador?,ENTY
När bröt superkontinenten Pangea upp?,NUM
Vilken typ av däggdjur är en hingstföl?,ENTY
Vem skapade Harry Lime?,HUM
Varför slutar många indianer inte högskolan?,DESC
Vilken färg har ett körsbärsträds blommor?,ENTY
Vem var president Clevelands hustru?,HUM
Vilken klass av djur utgör mer än två tredjedelar av kända arter?,ENTY
Vad hette Sergeant Preston från Yukons ledande hund?,ENTY
Vilken film presenterade en tuff karaktär som heter Kid Shelleen?,ENTY
"Vilket företag utsåg en av sina pennor till ""The Banana""?",HUM
Vad är huvudstaden i Monaco?,LOC
Vad väger engelsmän sig i?,NUM
Hur stor är valkollegiet?,NUM
Vad är det som går på fyra ben| sedan på två ben| sedan på tre?,ENTY
Vad heter förekomsten 1919 där brittiska trupper dödade över 3 obeväpnade indiska demonstranter?,ENTY
Vem uppfann Moog Synthesizer?,HUM
"Vem tillverkar ""Die Hard"" bilbatteriet?",HUM
Hur lång tid tar det att resa från Tokyo till Niigata?,NUM
Vilket stat ligger Filenes-butiken i?,LOC
Hur blir ett lagförslag till lag?,DESC
Vad är en radiografs startlön?,NUM
Vad är en sackarid?,DESC
Colin Powell är mest känd för vad?,DESC
Vilken stjärnhoppande ras ledde inhumanerna till Marvel's Earth?,ENTY
Hur köper du aktier?,DESC
Vad betyder anslag för pengar?,DESC
Vad heter Dolly Partons sällan sedd make?,HUM
"Var är den officiella ""nollan"" på havsnivån?",LOC
"Vems gamla London-utrop var: ""Köp min söta lavendel""?",HUM
Hur dog den tidigare WWF-brottaren Rick Rude?,DESC
Vem skrev texterna till Porgy and Bess?,HUM
"Vad är en ""falsk måne""?",DESC
Vilken 1976 Deep Throat-klon ger den ledande damen ett andra struphuvud?,ENTY
Vilken typ av bagage är uppkallad efter en berömd amerikansk flygare?,ENTY
Vad är ett ord vars bokstäver kan ordnas till ett annat ord?,ENTY
Vilket kapitel i Gone with the Wind har Rhett Butler lämnat Scarlett O'Hara?,NUM
Hur många amerikanska skådespelare nominerades till Oscar för bästa skådespelare 1983?,NUM
När dog Lucelly Garcia| en tidigare ambassadör för Columbia i Honduras?,NUM
"I Hemingways """"Old Man and the Sea""""| vilken typ av fisk fångar den gamle mannen?",ENTY
Hur länge var den längsta nysattacken?,NUM
Hur kan jag bli rik snabbt?,DESC
Hur uttalas ordet 'qigong'?,DESC
Vilket program behöver jag köra en .tbk-fil?,ENTY
Vad är sjömansnamnet för Sydamerikas södra spets?,LOC
Vilka två New York Yankee-kastare bytte fruar och familjer?,HUM
Vilka är de tio plågorna av Egypten?,ENTY
Vad är historien om Hot Wheels-bilar och hur produceras de?,DESC
Vad heter den rundade delen på toppen av en tändsticksbok?,ENTY
När besökte Nixon Kina?,NUM
Vilken är den tredje månaden i den gregorianska kalendern?,NUM
Vilket land äger Korsika?,LOC
Hur många drottningsbin regerar i en bikupa?,NUM
Vilken sport har slotbacks| tailbacks och touchbacks?,ENTY
Vilket kött kompletterade sötpotatis och ärtor under den första TV-middagen?,ENTY
Vad är RAM i datorn?,ABBR
"Vad är en ""upprepande väljare""?",DESC
Vad är dingoes?,DESC
Var kan jag hitta en världsatlaskarta online utan kostnad?,LOC
Vilken Leoncavallo-opera har en prolog av en clown?,ENTY
Hur kan jag få någons e-postadress?,DESC
Vilket kapitel i Bibeln har flest verser?,NUM
Vilket hav sjönk Titanic in?,LOC
Hur fakturerade PT Barnum den diminutiva Charles S. Stratton?,DESC
Vilket år byggdes muren?,NUM
Namnge en av kung Henry VIIIs fruar.,HUM
Vilken sydvästra stat kallas Silverstaten?,LOC
Vad är granatäpplen?,DESC
Varför arbetar apotekare på upphöjda golv?,DESC
Vad jobbar Robin Williams med?,HUM
Vilket land invaderade de allierade i andra världskrigets operation Avalanche?,LOC
Vilken berömd flod var Hernando de Soto den första europén att se?,LOC
Vilket schackresultat blir resultatet när en spelare inte har något lagligt drag?,ENTY
Hur hittar de ett epicentrum?,DESC
När föddes Kristus?,NUM
Var börjar kvalitetsdrycker?,LOC
Vilka färger är de fyra ränderna på en burk Pepsi uppifrån?,ENTY
Vilken typ av ämne är dextropropoxifen-napsylat?,ENTY
Vem är den franska litterära karaktären som främst är känd för sin enorma näsa?,HUM
Vad användes först av John L. Sullivan och James J. Corbett 1892?,ENTY
Vilket land omger San Marino| världens minsta republik?,LOC
Vem dödade Martin Luther King?,HUM
Vem äger rättigheterna i ett TV-program?,HUM
Vad satt Cool Hand Luke i fängelse för?,DESC
"Vad var V-8 Juice-sloganen: ""smaklöken""?",DESC
Vilken var Mae Wests senaste film?,ENTY
Vilken bokstav börjar Gorbatjovs mellannamn med?,ENTY
Vem uppfann Astroturf?,HUM
Vad gör dig fet?,DESC
Namnge ett flygande däggdjur.,ENTY
Vilken säsong äger en hiemal aktivitet normalt rum under?,NUM
I vilken riktning vetter de bästa surfstränderna?,LOC
Vad är världsrekordet för det längsta håret?,NUM
Vilket engelskt ord innehåller flest bokstäver?,ENTY
Hur vet jag om jag är avundsjuk på någon?,DESC
Vilken demokratisk prankster ledde tåget ut från stationen medan Richard Nixon talade från caboosen?,HUM
Hur tar James Bond sina martinis?,DESC
Vilken Kalifornisk viks största ö är Angel Island?,LOC
Vad hette flygningen som Fawaz Younis kapade?,ENTY
Vilken tidigare afrikansk ledare höll sitt lands boxningstitel i nio år?,HUM
Vad är en våt dröm?,DESC
Vilken bro i Kalifornien var Don Brown den första som korsade den 27 maj 1937?,LOC
"Vilket kameraföretag sa: """"Om du inte har tid| då har vi kameran""""?",HUM
Vad hände med Pepsi Clear?,DESC
Hur mycket kostar ett ton cement?,NUM
Vad är en mexikansk hårlös?,DESC
Vilken amerikansk poet från 2000-talet skrev en biografi om Abraham Lincoln i fyra volymer?,HUM
Var är det äldsta levande tinget på jorden?,LOC
Vilket smycke visas på Monopolys lyxskattutrymme?,ENTY
Vem slutade skriva dagboksinlägg den 31 maj 1669| för att han trodde att han blev blind?,HUM
Vilken journalist kan hittas i och runt Walden Puddle?,HUM
Hur dog Sokrates?,DESC
Hur många sidor har en obelisk?,NUM
Vilken var Edward Albees första teater i full längd?,ENTY
Vad förlorades och återfanns av poeten John Milton?,ENTY
Vilken kvinnlig kastare har slagit ut Ted Williams och Hank Aaron?,HUM
Hur kan forskare förutsäga väder genom att observera moln?,DESC
Vilka låtar var populära 1948?,ENTY
Vilket år uppfanns kanonen?,NUM
Hur många språk talar påven?,NUM
Vilken vik skiljer Marylands östra och västra stränder?,LOC
Vad heter sångaren Madonna på riktigt?,HUM
"Vilken fransman hävdade följande? Om Gud inte fanns skulle det vara nödvändigt att uppfinna honom. """,HUM
Vilken färg hade Ernest Hemingways ögon?,ENTY
"Vad är ursprunget till uttrycket ""ord av fyra bokstäver""?",DESC
Vem var den första kvinnan i rymden?,HUM
Vilket är det enda djuret som kan vända magen in och ut?,ENTY
Vilken professionell idrottsliga gav upphov till collegeutkastet?,HUM
Vad är skillnaden mellan en styrelse och en rådgivande styrelse?,DESC
Vem upptäckte imaginära siffror?,HUM
Vem gör Simpsons röster?,HUM
Hur många meter högt är hindret framför en löpares vattenhopp?,NUM
Vilken religion har flest medlemmar?,ENTY
Hur många kalorier finns det i ett glas vatten?,NUM
