text,coarse label
Irakierna inledde sin attack mot Kuwait vilken dag?,NUM
Vilken bokstav pryder Rwandas flagga?,ENTY
Vad tillverkar en möbeltillverkare?,ENTY
Vad är Gud?,DESC
Vilket lands nordligaste stad är Darwin?,LOC
Vilket ljud förbiser Olympia| Washington?,LOC
Vilken TV-serie berättade om Katy Holstrum och kongressledamoten Glen Morleys liv?,ENTY
Vilken stad i Kentucky kallar sig The Horse Center of America?,LOC
Hur många penny-farthings finns det på ett Trivial Pursuit-spelbräde?,NUM
Vad är det vanligaste elementet i solen?,ENTY
Vilket europeiskt land kan skryta med staden Furth| där floderna Rednitz och Pegnitz sammanfaller?,LOC
Vilken stat i USA är Dixville Notch i?,LOC
Var låg Cisalpine Republic| 1797-1850?,LOC
Vilket är det största köpcentret i världen?,LOC
"Vad heter huvudpersonen i Dostojevskis ""Idioten""?",HUM
Vilken straffruta ligger mellan Baltic Avenue och Reading Railroad på ett Monopol-spelbräde?,ENTY
Vilken presidentsekreterare avfärdade Watergate som ett undermåligt inbrottsförsök?,HUM
Vad är en surikat?,DESC
Vem var Jean Nicolet?,HUM
Vilken typ av djur var Winnie the Pooh?,ENTY
Vilka av dessa är författare?,HUM
Vad är det internationella radiokodordet för bokstaven B?,ENTY
Vem var den ursprungliga Humpty Dumpty?,HUM
Vad är cacheminne?,DESC
Aspartam är också känt som vad?,ENTY
Var ligger Orange Bowl?,LOC
När är president Nixons födelsedag?,NUM
"Vad är ursprunget till Mellanvästra slangen| ""du är jävla tootin""?",DESC
Vems skåp var kalt?,HUM
Vilka är de sju haven?,LOC
Vad står IBM för?,ABBR
Vad är skillnaden mellan jazz och blues?,DESC
Vad är C-programmeringsspråket?,DESC
Vad heter Popeye's adopterade son?,HUM
Vem uppfann dammsugaren?,HUM
"Vad är en ""lånegrop""?",DESC
Vilken fiktiv karaktär från 2000-talet går på Pencey Prep School?,HUM
Hur många människor i USA säger att deras främsta informationskälla är tidningen?,NUM
Vem lånar Shakespeares Antonio 30 dukater från?,HUM
"Vilket land är känt som ""Big Bear""?",LOC
"Vad """"smälter i munnen| inte i dina händer""""?",ENTY
"Hur många gånger om dagen ska du ta ett receptläkemedel märkt ""qid""?",NUM
Vad är atomens ursprung?,DESC
Vem är Voyagers projektledare?,HUM
Vilka radiostationer sänder Jim Bohannon Radio Talk Show?,HUM
Vilka två befälhavare styrde styrkorna i slaget vid El Alamein?,HUM
"Namnge skaparen av ""The Muppets""?",HUM
Hur skickar jag e-post till någon på aol.com från yahoo.com?,DESC
"Vem svarade ""Jag vet"" på prinsessan Leias bekännelse ""Jag älskar dig"" i The Empire Strikes Back?",HUM
Vad betyder namnet Ella?,DESC
Vad är Rockettes hem?,LOC
Var kan jag hitta all information jag behöver veta om det engelska inbördeskriget| 1642-1649?,LOC
Vad heter företaget som tillverkar Spumante?,HUM
Vilken sport spelas på det största fältet?,ENTY
Vem vann 1967 Oscar för bästa skådespelare?,HUM
Vad är efter döden?,ENTY
Namnge den första privata medborgaren som flög i rymden.,HUM
Vad var fotbollsstjärnan Elroy Hirschs smeknamn?,HUM
"Vilken sångare sjunger ""Oh Boy""?",HUM
Hur mycket pizza äter amerikaner på en dag?,NUM
Vad är webbplatsen för USA-tidskriften?,LOC
Vilken arméns motto är Blood and Fire?,HUM
Vilken typ av patent fick Ermal Fraze 1963?,ENTY
Vad hör du när du sätter ett snäckskal på örat?,DESC
Varför är spökhus populära?,DESC
Vilket kön har större lår?,ENTY
Vilken amerikansk stat har den näst längsta kusten?,LOC
Vilken stat har Buffalo Bill Historical Center?,LOC
Hur snabbt springer geparder?,NUM
Vad illustreras med Ray Bradburys illustrerade man?,ENTY
Hur snabb är en 45Mhz-processor?,NUM
Vilken typ av pussel dök upp första gången i USA i New York World den 21 december 1913?,ENTY
Vilken greve skrev Alexandre Dumas om?,HUM
Vad är oddsen för att föda tvillingar?,NUM
Vad är den största naturliga sjön i Pennsylvania?,LOC
Hur långt är det från London UK till Kalifornien?,NUM
"""Namnge de två mystiska korparna som Odin har kommandot på.",ENTY
Vilken art var Winnie the Pooh?,ENTY
Vad är viruset HIV?,DESC
Hur många år är Benny Carter?,NUM
Vilken bok från Hermann Hesse gav namn till en rockgrupp?,ENTY
Var börjar och slutar Santa Fe Trail?,LOC
Vilken bok är uppföljningen av Future Shock?,ENTY
Vilka afrikanska djur är kända som The Big Five?,ENTY
Vad är alfabetet för latin?,ENTY
Vad är rädslan för grodor?,ENTY
Vilken stad i Kanada är den minst befolkade?,LOC
Hur gammal är Stevie Wonder?,NUM
Vem var den första taiwanesiska presidenten?,HUM
Vem är Luke Skywalkers far?,HUM
Vad längtar en dipsoman efter?,ENTY
"Vad är definitionen av termen ""vapensystem""?",DESC
Vad är Christopher Marlowes och Shakespeares litterära bidrag till engelsk litteratur?,DESC
Vad är Nero Wolfes favoritdryck under kontorstid?,ENTY
Vilket är det första persondataföretaget?,HUM
Vad är det mest effektiva sättet att starta en grill?,ENTY
Vem var Jane Goodall?,HUM
Varför finns det punktskrift på bankomaterna som människor kör igenom?,DESC
Var ligger Isle of Man?,LOC
Vilken bok skrev Aaron Hass?,ENTY
Vad var antalet döda vid utbrottet av berget Pinatubo?,NUM
När börjar årtusendet officiellt?,NUM
"Vem skapade serietidningen ""Garfield""?",HUM
Vilken vietnamesisk terrorist är nu en FN-delegat i Doonesbury?,HUM
Vad är realtidsbehandling?,DESC
Vad kallar vi den imaginära linjen längs toppen av Rocky Mountains?,LOC
Vilket lands huvudstad är Lagos?,LOC
Var äger Ray Bradbury's Chronicles rum?,LOC
Vem är Rysslands nuvarande premiärminister och president?,HUM
Vem etablerade en vikingakoloni på Grönland omkring 985?,HUM
"Vad var det som kännetecknade hunden ""Little Rascals""?",ENTY
Vad är latitud och longitud för El Paso| Texas?,NUM
Var kan jag få information om cystisk fibros?,LOC
Var styrde Honecker?,LOC
Vad är teorin om likvärdighetstillstånd?,DESC
Vad samlar en filatelist in?,ENTY
Hur lång är den genomsnittliga apans livslängd?,NUM
Hur många medlemsstater finns i FN?,NUM
Vem sköt och dödade sig själv när han målade Wheatfield with Crows?,HUM
Vad händer när natrium läggs i vatten?,DESC
Vad betyder UOL?,DESC
Vilken framtida president blev senats majoritetspisk under Harry Truman?,HUM
Vem var arkitekten för Central Park?,HUM
Vilket operativsystem körs på IBM-kompatibla maskiner?,ENTY
Vilka är dimensionerna på ett ishockeymål?,NUM
När sändes CNNs första sändning?,NUM
Vilka är tecknen på att ett land går in i en lågkonjunktur?,ENTY
Vad är circumorbital hematom?,DESC
Vilket afrikanskt land styrs från Ouagadougou?,LOC
Vad var det kristna namnet på titelkaraktären i Our Miss Brooks?,HUM
Vilken hörselskadad konstnär målade solrosor?,HUM
Vilka var Yankees frekventa fiender?,HUM
Vem skrev Sons and Lovers?,HUM
"Vad är den engelska översättningen för ordet ""caliente""?",ENTY
Vilket hantverk kräver att du flätar varp och väft?,ENTY
Vilken fransk hamn påstår sig vara Vins hem?,LOC
Hur lång tid tar det solljus att nå jorden?,NUM
Hur många millisekunder på en sekund?,NUM
Vilken Cherokee Indian gav sitt namn till ett träd?,HUM
När introducerades videokameror i Malaysia?,NUM
Vad är chansen att bli gravid med fyrlingar?,NUM
Vem var stjärnan i Leave It to Beaver?,HUM
Vilka länder har de största väpnade styrkorna i världen?,LOC
Vad var William F. Codys bättre kända namn?,HUM
Hur ökar jag min biceps?,DESC
Till vem lämnade Richard Nixon sin avgång till?,HUM
Vem var Thucydides?,HUM
Hur renas grundämnet strontium?,DESC
Vilka av följande rock'n roll-stjärnor har en stjärna på Hollywood Boulevard?,HUM
Vad är halsmandlar till för?,DESC
Vilka molekyler inkluderar fluor| natrium och magnesium?,ENTY
Vad hette bollspelet som mayaindinerna spelade?,ENTY
Vad var uppföljaren till The Moon's Balloon?,ENTY
Vad är växelkursen för australiska till amerikanska pengar?,NUM
"Vad är ursprunget ordet ""posh""?",DESC
Hur kan någon se att en kvinna hade samlag?,DESC
Hur många stater hade Richard Nixon 1972?,NUM
Vilken basketmanöver uppfann Bert Loomis?,ENTY
Vad är en bra bok att läsa för människor som hatar att läsa?,ENTY
Hur många shilling mer än 2 fanns det i en guinea?,NUM
Vad äter en tarantula?,ENTY
Vilka är de tre sekundära färgerna?,ENTY
"Vad betyder namnet ""Sabrina""?",DESC
Vem tog över som ledare för Boston Pops efter Arthur Fiedlers långa regeringstid?,HUM
Vad hette rättegångarna som följde efter andra världskriget?,ENTY
Vad är hebephrenia?,DESC
Vilken nazistledare dödade sig själv i fängelse strax innan han skulle avrättas som krigsförbrytare?,HUM
Vilka kända händelser har hänt den 27 mars?,ENTY
"Vilket företag påstod sig vara ""världens största leksaksaffär""?",HUM
Vilket varumärkesnummer pryder den svarta etiketten på en flaska Jack Daniel's?,NUM
Vad kallar jag mina kusiners söner och döttrar?,ENTY
Vad var orsakerna till inbördeskriget?,DESC
Vad är Maid-Rites?,DESC
Vilken stad terroriseras av Dracula i The Night Stalker?,LOC
Hur kan du förhindra det?,DESC
Vad betyder namnen Andrew och Christina?,DESC
Vilken chokladkaka skapad av Frank Mars och hans fru kallas ofta en Vintergata med jordnötter?,ENTY
Vem är den snabbaste gitarristen?,HUM
Vad lagrar kameler i sina knölar?,ENTY
Vad heter den andra rymdfärjan?,ENTY
Vilket är det bästa ortopediska sjukhuset i landet?,LOC
Vad är perfekt tempus?,DESC
Vad anses ofta vara den femte sinnet?,DESC
Vad var ett annat namn för Östtyskland?,ENTY
Vilken är den näst mest sålda tidningen i Amerika?,ENTY
Vem förrådde Norge till nazisterna?,HUM
Vem behöll leksakerna som donerats till Doodyville Orphans Fund för sig själv?,HUM
Vad är en Bourdon Tube?,DESC
Vilken typ av idrottslag är Wisconsin Badgers?,ENTY
Vilka var Picts?,HUM
Vad har Caroll Baker| Tammy Grimes| Debbie Reynolds och Judy Garland gemensamt?,DESC
Vad är film noir?,DESC
Vem är stationerad på Camp Swampy i serierna?,HUM
Vilket år upprättade Kina och Koreanska Republiken diplomatiska förbindelser?,NUM
Vad orsakar tuberkulos?,DESC
Hur lång är giraffen?,NUM
Vilken skådespelare klädde sig ut som jultomten och hade en gång per år en affär med skådespelerskan Shelley Winters varje jul i många år?,HUM
Vilket djur var den värmesökande missilen Sidewinder kallad efter?,ENTY
Hur lång tid tog det Stanley att hitta Livingstone?,NUM
"Hur mycket av landets barn mellan två och elva år tittar på ""The Simpsons""?",NUM
Vilken sjö ligger Sheboygan på?,LOC
Vad är ett baseballlags brandmän?,DESC
Vad är en rädsla för färg?,ENTY
Vilket Nantucket-skeppsbrott dödade fler dykare som utforskade det än de 52 personer det sjönk med?,ENTY
Vilka är de två största fåglarna på jorden?,ENTY
"Nämn de fyra berättelserna i Edith Whartons ""Old New York&"".",ENTY
Vilken är den största sjön i Nordamerika?,LOC
Hur många människor dog på grund av ett rökproblem 1997?,NUM
Vad är kronisk förstoppning ett symptom på?,ENTY
Vem skrev The Look of Love efter att ha sett Ursula Andress?,HUM
Vad heter den amerikanska simmare som vann sju guldmedaljer vid OS 1972?,HUM
Vem påstår att ha den största showen på jorden?,HUM
Vad är Head Start?,DESC
Vilken Honeymooners-skådespelerska utsåg tidningen Television som 1953:s mest lovande stjärna?,HUM
Varför kan kvinnor inte tjäna i marinen ombord på ubåtar?,DESC
Vad ledde Yaltakonferensen till?,ENTY
Vilken hund döptes till The Mortgage Lifter?,ENTY
Vad är saltpeter?,DESC
Vad är skillnaden mellan JD och LL.M.?,DESC
"Vilken typ av organisation är ""Last Chance for Animals""?",HUM
Vilken roll hade Medeltidsgilden?,HUM
Silly putty uppfanns av vem?,HUM
Vad ska man ställa in ugnen på för att baka Peachy Oat Muffins?,ENTY
Hur kan någon bli federal agent?,DESC
Vem uppfann gemet?,HUM
Vem gifte sig Lauren Bacall med efter att hennes man Humphrey Bogart dog?,HUM
Hur många gånger var John Havlicek medlem i stjärnlaget under sin 16-åriga National Basketball Associaton-karriär?,NUM
Vilken stad eller stat bor det mest homosexuella i?,LOC
Shea och Gould hade ett kontor i Los Angeles hur länge innan de stängde det?,NUM
Vilket ord förekommer 46227 gånger i Bibeln?,ENTY
Hur kan du vara lycklig?,DESC
Hur skulle någon göra för att bli organdonator?,DESC
"Vilket år skapade Degas bronsskulpturen ""Fjärde positionens front""?",NUM
Vilken kompositör tilldelades hedersmedaljen av Franklin D. Roosevelt?,HUM
Hur många URL-tillägg finns det? och vilka är de?,NUM
Hur lång tid efter samlag tar det att ta reda på om du är gravid?,NUM
Vad står U.S.S.R för?,ABBR
Vem skapade de fantastiska fyra| Hulk och Thor?,HUM
Vad är en rädsla för gravitation?,ENTY
"Vem är kompositören till ""Canon in D Major""?",HUM
Vad gjorde inte Rocky Marciano i sin professionella boxingkarriär?,DESC
Var är alla europeiska och amerikanska ålar födda?,LOC
"Vem var författaren till romanen ""Far From the Madding Crowd""?",HUM
"Vad är definitionen av ""grafiska detaljer""?",DESC
"Vad var ""Amerikas cigarett med infälld filter""?",ENTY
Vilken typ av hund är Scooby Doo?,ENTY
Vilken funktion har blindtarmen?,DESC
Vilken varuhusarving är ansvarig för att höja ett tre-ton kassaskåp från Andrea Doria undervattensbrott?,HUM
Vilket kön är dubbelt så troligt att det blir spetälskt?,ENTY
Vilken var den första staden som auktoriserades i Vermont?,LOC
Vilken stat har den längsta Great Lakes-kustlinjen?,LOC
Vilken amerikansk stat slutar med ett G?,LOC
Hur många tvillingsorter finns det?,NUM
Vad är en kartesisk dykare?,DESC
Vilka är de största biblioteken i USA?,LOC
Hur många människor bor på Falklandsöarna?,NUM
Vem Camp David kallad efter?,HUM
Vilket dokument ville president Andrew Johnson ha en kopia av under hans huvud när han begravdes?,ENTY
"Vem porträtterade ""mannen utan ansikte"" i filmen med samma namn?",HUM
Vad hände i dogtown 1899 för att göra det året ihågkommen?,DESC
Vilket hjul uppfann Blaise Pascal i en sökning efter evig rörelse?,ENTY
Hur mycket pengar var minimilönen 1991?,NUM
Vilket år erhölls det första patentet på dragfliköppnaren på burkar?,NUM
Vilket land har flest dammar?,LOC
Vad är ordinarie pris?,NUM
Vilket landmärke i Metropolis introducerades först i Superman-teckningarna på 1940-talet?,LOC
Var kan man hitta Moçambique?,LOC
Hur känner man igen anorexi?,DESC
Vilken Mary Tyler Moore Show stamgäst kom till världen som Tadeus Wladyslaw Konopka?,ENTY
I vilken stad ligger den amerikanska självständighetsförklaringen?,LOC
Vilken är den största sorten kaktus?,DESC
Vem vann första världsserien?,HUM
Vad skrev Aaron Hass?,ENTY
Vem är Samuel Pickering?,HUM
Vad var företaget för den animerade Sky Hawks?,HUM
"Vem ansågs ha sagt: ""Jag träffade aldrig en man som jag inte gillade""?",HUM
Vilka overaller är kallad efter Dungri| en förort till Bombay?,ENTY
Varför avger hustaken ånga efter en stor regnskur?,DESC
Vilken nationalitet var Jackson Pollock?,LOC
Hur mycket av jordens yta är permanent fryst?,NUM
Vad är sambandet mellan New Krypton och Daxam?,ENTY
När föddes drottning Victoria?,NUM
Hur många personer avrättades för Abraham Lincolns mördande?,NUM
Vad måste en Las Vegas blackjack dealer göra när han fyller 16?,DESC
Vad är värt att se i Reims?,LOC
Vilken typ av artist är Ileana Cotrubas?,ENTY
När återförenades Jemen?,NUM
Vilken serie godisprodukter inkluderade Super Skrunch och Peanut Butter Oompas?,ENTY
Varför skilde sig den anglikanska kyrkan från Vatikanen?,DESC
Vilken organisation har ett säkerhetsråd?,HUM
Hur skulle jag hitta priset på olika organ som donerats?,DESC
Vilken mexikansk ledare dödades 1923?,HUM
Vad betyder NECROSIS?,ABBR
Vad är magnetar?,DESC
Vilken fejd slutade med ett äktenskap i Kentucky den 21 mars 1891?,ENTY
Vilken färg har randen längs vardera sidan av en Coho-lax?,ENTY
Vad är den federala minimilönen?,NUM
Mississippi har smeknamnet vad?,ENTY
Vad är arbetslöshetsstatistiken för åren 1965 och 1990?,NUM
Var är Santa Lucia?,LOC
Vilken kvinnlig målare producerade primitiv av det lantliga livet i New England?,HUM
Vad heter de två gamla män som dyker upp i tv-serien Muppets Show?,HUM
Vilket krig såg strider vid Parrot's Beak och Black Virgin?,ENTY
Vad ska du skrika för att kalla på en taxi i Madrid?,DESC
Vad är hästkrafterna hos skyttelboostrarna?,NUM
Vilket år började Apartheid?,NUM
Vem skapade Big Ben?,HUM
Vilken stad finns i staden OZ?,LOC
Vad någonsin hände med det en gång så populära Yale Lock Company?,DESC
Namnge Marvel-laget som är löst baserat på DC: s Justice League of America?,HUM
Vad fick en aztec-idrottare från 1500-talet för att ha satt en gummikula genom en ring?,ENTY
Vilken befolkningsrik stat täcker 49576 kvadrat miles?,LOC
Vilket högskolefotbollslag byggde Knute Rockne till en makt?,HUM
I vilken stat var det ett oljeutsläpp på 11 miljoner liter?,LOC
"När skrev Aldous Huxley ""Brave New World""?",NUM
Vilket land kallade de forntida romarna Hibernia?,LOC
I vilken högriskföretagssatsning satsade och förlorade Jimmy the Greek?,HUM
Vad kallar kockar The Master Spice?,ENTY
Vad är förkortningen av General Motors?,ABBR
Vad är en Devo-hatt?,DESC
Hur lång var den längsta hickaattacken?,NUM
Vilken typ av vapen användes i medeltida krigföring?,ENTY
Hur många bor i Tokyo?,NUM
Vilken frukttoppad skådespelerska var känd som The Brazilian Bombshell?,HUM
Vad är fåglar härstammande från?,ENTY
När Tutankhamun-utställningen ställdes ut i USA| vilket flyttningsföretag transporterade den?,HUM
Vilken Kevin Costner-film involverar Sioux-indianerna?,ENTY
Vem spelade titelrollen i My Favorite Martian?,HUM
Hur fungerar en vetenskaplig miniräknare?,DESC
Vad är en rädsla för päls?,ENTY
Vem uppfann spelet Alfapet?,HUM
"Vilken del av deras klädsel var ""pothooks"" för cowboys i det gamla väst?",ENTY
När började människor först skriva historia på allvar?,NUM
Varför måste vi gå i skolan?,DESC
Vad är Toulmin-logik?,DESC
En corgi är ett slags vad?,ENTY
Vilken stad i USA upplevde mest tillväxt nyligen?,LOC
Vad är en dinglande particip?,DESC
Vilken Tokyo-gata glittrar med berömda varuhus och nattklubbar?,LOC
Vad var den genomsnittliga livslängden under stenåldern?,NUM
När Mighty Mouse blev påtänkt| vad var hans ursprungliga namn?,HUM
Vad är fredsymbolens ursprung?,DESC
Vilken grupp spelade i filmen Rock Around the Clock?,HUM
Hur många amerikanska presidenter mördades under drottning Victorias regeringstid?,NUM
När uppfanns den första spoltoaletten?,NUM
Vad är Nathan Hamills roll i den nya Star Wars-prequellen?,HUM
Hur många diskar har varje spelare i ett spel med Crokinole med fyra händer?,NUM
Hur gammal är solen?,NUM
"Hur stor andel barn mellan två och elva år tittar på ""The Simpsons""?",NUM
Hur hittar jag en lista med adresser| fax och / eller e-postadresser för personalavdelningar i Massachusetts?,DESC
Hur skriver jag till min kongressledamot?,DESC
Hur många år sedan släppte Led Zeppelin sitt senaste album?,NUM
Vad är termen för en grupp gäss?,ENTY
Hur många personer dömdes Randy Craft för att ha dödat?,NUM
Vad hette den berömda striden mellan Texas och Mexiko?,ENTY
I vilket land befinner du dig om du wooar i Wu-dialekten?,LOC
Vad kallar du en pokerhand med fem kort av samma färg?,ENTY
Vilken New York Yankee var känd som The Iron Horse?,HUM
Vem anses vara The First Lady of the American Stage?,HUM
"Vem skrev: ""Varken en låntagare eller en långivare vara""?",HUM
Vad är moxie?,DESC
Vad var den första Sam Spade-romanen?,ENTY
Vilken låt fick Patti Page upp folk till dans till år 1950?,ENTY
Vem ledde Hitlers ökända Gestapo?,HUM
Vilken sydamerikansk stad har den exklusiva Copacabana Beach och Ipanema?,LOC
Vilken tysk stad kallar italienarna Monaco i Bayern?,LOC
Vilken ögrupp innehåller Jersey| Guernsey| Sark och Herm?,LOC
Vad är en rädsla för starkt ljus?,ENTY
Vad heter en person som gillar eld?,HUM
Var upptäcktes helium först| därav namnet?,LOC
Vad är det bästa sättet att övervinna en rädsla?,ENTY
Namnge en sydafrikansk diamantproducent?,HUM
Vem gjorde den musikaliska uppmaningen var sann mot din skola?,HUM
"Vad fransk designer förklarade: ""Jeanen är förstöraren! Det är en diktator! Det förstör kreativiteten. Jeanen måste stoppas!""?",HUM
Vilken säsong är omgivningen för Shakespeares midsommarnattsdröm?,NUM
Namnge ett band som var känt på 1960-talet.,HUM
Vilken komiker förbjöds från Ed Sullivan Show för att ha gjort en obscen gest mot showens värd?,HUM
Vilket land är scenen för Edgar Allan Poes The Pit and the Pendulum?,LOC
Vilken Apollo 11-astronaut tog hand om butiken medan Armstrong och Aldrin gjorde historia?,HUM
Vad är det aktuella biljettpriset från Kairo till Barbados?,NUM
Vad är den näst högsta bergstoppen i världen?,LOC
Vilken Good Little Witch är Caspers flickvän?,HUM
I vilket Tennessee Williams uppsättning blir en av karaktärerna dödad och slukad av en massa svältande barn?,ENTY
Vad var smeknamnet på Fredrik I| den heliga romerska kejsaren och Tysklands kung?,HUM
Vilket krig följde Potsdam-konferensen efter?,ENTY
Vad är den vanligaste icke-smittsamma sjukdomen i världen?,ENTY
Vilken månad| datum och år dog Charles I?,NUM
Hur många kubikfot rymmer en liter vatten?,NUM
Vad kallas frisyren som nya militära rekryter får?,DESC
Vilken är världens största katedral?,LOC
Vilka effekter har nitrater på miljön?,DESC
Vad är Nitrox dykning?,DESC
Vilka tre europeiska länder börjar med bokstaven A?,LOC
Vad hände under den långa marschen?,DESC
Vad hette Hitlers misslyckade försök att störta den bayerska regeringen i München 1923?,ENTY
Hur kan jag hitta stavning online?,DESC
Hur många daggmaskar finns i en enda betesmark?,NUM
Vem skapade Stonehenge?,HUM
Vad är den genomsnittliga timlönen för amerikanska arbetare?,NUM
Vilken sport har snatches och rena ryck?,ENTY
Vem är grundaren och redaktören för The National Review?,HUM
Vilket år byggde de Berlinmuren?,NUM
Vem var den första guvernören i West Virginia?,HUM
Vilken är världens längsta hängbro?,LOC
Vilken asiatisk stad har världens största bowlinghall?,LOC
När kommer Jean Aeul att publicera sin nästa bok?,NUM
Vilken berömd soldat föddes i Europa| dog i Asien och blev lags att vila i Afrika?,HUM
När är det dags att koppla av| vilken öl står klar?,ENTY
Vilken kultur utvecklade idén om potlatch?,HUM
Vilket basebollag blev Minnesota Twins?,HUM
Vilken typ av gitarr spelade Jimi Hendrix?,ENTY
Vilka var de tre första städerna med en befolkning på mer än en miljon?,LOC
Vilken konstellation innehåller tvillingarna Castor och Pollux?,LOC
Hur många meter är det på en mil?,NUM
Vad är en gasutsläppshändelse?,DESC
Vilken James Michener-bok har undertexten Spanish Travels and Reflections?,ENTY
Vilken berömd straffdomstol i London var en gång ett feodalt slott?,LOC
Hur många milligram är i ett gram?,NUM
Vilket strängvapen skjuter en bult?,ENTY
Var fick han titeln?,LOC
Var kan jag hitta en stor lista med ord med 5 till 6 bokstäver?,LOC
Vad är Michael Jacksons mellannamn?,HUM
Vem var den första kvinnan som flög solo över Atlanten?,HUM
Hur lång är människans graviditet?,NUM
"Vad betyder ""Semper Fidelis""?",DESC
Vilken typ av kostym hade äkta hepcats 1942?,ENTY
Var bor Mother Angelica?,LOC
Hur kan jag ta reda på mitt måntecken?,DESC
Varför behöver ett ljus en veke?,DESC
Musikern Ray Charles spelar vilket instrument?,ENTY
Vilka var de tre profetior som häxorna gjorde mot Macbeth?,DESC
Hur stor är befolkningen i Mississippi?,NUM
Vem startade Dominos Pizza-kedjan?,HUM
I vilken film spelade Steven Spielbergs hund huvudrollens hund?,ENTY
Vilka är de olika typerna av preventivmedel?,ENTY
Hur gammal är Jeremy Piven?,NUM
Vad är yo-yos historia?,DESC
Vilken NBA-spelare hade tröjnummer 0?,HUM
Vilket chokladföretag ger dig en enpundskyss?,HUM
Hur uttalar man 'qigong' korrekt?,DESC
Vad fossiliseras för att bilda koprolit?,ENTY
Hur många färgade rutor finns det på en Rubiks kub?,NUM
Var ligger Mayo Clinic?,LOC
Vilken karibisk ö kallas ibland Little England?,LOC
Var ligger Amsterdam?,LOC
Var hittar jag texten till låten ''Att gifta sig idag'' från musikalen ''Company''?,LOC
"Vad är ett annat ord som betyder ""vet allt""?",ENTY
Vem är den berömda filmstjärnan som också agerade som avloppskommissionär i Provo Canyon| Utah?,HUM
Vilken australisk stad blev America's Cup hem?,LOC
Aspartam är känt under vilket annat namn?,ENTY
Vad är pasta?,DESC
Namnge Randy Crafts advokat.,HUM
"Vilken färg är ""ask""?",ENTY
Vad är det bästa universitetet på distans?,HUM
Vilken flod är Grand Coulee Dam damm til?,LOC
Hur ofta föds fyrlingar?,NUM
Hur försvinner psorisis?,DESC
Hur många presidenter har dött den 4 juli?,NUM
Vilka tre färger finns på den franska flaggan?,ENTY
Vad är mysteriet med Bermudatriangeln?,DESC
Vilka är världens sju underverk?,ENTY
Vad står CNN för?,ABBR
Vad heter en person som gillar eld?,HUM
Vem porträtterade Vincent Van Gogh i Lust for Life?,HUM
Vad utgör en vuxen?,ENTY
Vad är en pålitlig webbplats där jag kan ladda ner Heretic 2?,LOC
Vad är en neurokirurg?,DESC
Vilket baseballresultat krävde nio bollar 1879| åtta bollar 1880 och sju bollar 1881?,ENTY
Vad är amaretto kex?,DESC
Vilken vanlig sjukdom kan du inte fånga på nordpolen?,ENTY
Vilken säsong börjar med vårdagjämningen?,NUM
Vem var känd som Time Master i serietidningar?,HUM
Vad hette Roy Rogers hund?,ENTY
Vilka TV-serier ändrade namnen för att skydda de oskyldiga?,ENTY
Var rullade linbanor först ner på Clay Street 1873?,LOC
Vad är George Lucas e-postadress?,LOC
Hur ger jag en bra massage?,DESC
Vem är datorns far?,HUM
"Vad är ursprunget till ""jiggy"" som att bli jiggy med det?",DESC
Vad är ursprunget till am och pm?,DESC
Vad är definitionen av kosmologi?,DESC
Vad heter hunden på Cracker Jack-förpackningen?,ENTY
Vad är manifesterade och latenta funktionsteorier?,DESC
