text,coarse label
Hur många kejsare fanns det i det romerska riket?,NUM
"Vad hette skaparen av ""The Muppets""?",HUM
Vad är Cabarnet Sauvignon?,DESC
Vad är en virtuell IP-adress?,DESC
Vad heter tigern som annonserar för Frosted Flakes flingorna?,ENTY
"Vem skickade det korta meddelandet """"Jag kom| jag såg| jag segrade""""?",HUM
Vilken färg har herr Spocks blod?,ENTY
Vilken amerikansk flygvapengeneral ledde den första bombningen över Tokyo?,HUM
"Vilken USA:s vice president sa: ""Vissa tidningar kasserar sitt skräp genom att skriva ut det""?",HUM
Vad hette den första Watergate-åklagaren| som senare avskedades av Nixon?,HUM
Hur fungerar filmbluesskärmar?,DESC
Hur påverkar magnetens hastighet i en generator generatorn?,DESC
Vilket är det sovjetiska kommunistpartiets högsta beslutsfattande organ?,HUM
Vad var Vietnamkriget?,DESC
Vad är La Nina?,DESC
Varför brann Globe Theatre ner?,DESC
Vilken dag gifte sig John F och Jackie Kennedy?,NUM
Vad var den facklitterära bästsäljaren 1952| 1953 och 1954?,ENTY
Vad menas med blod SED-frekvens?,DESC
Vilken är den nomadiska jakt- och samlingsstammen i Kalahariöknen i Afrika?,HUM
Vem vann ett Pulitzerpris för sin roman The Caine Mutiny?,HUM
Vad är det bästa sättet att tappa fläsket under hakan och runt ansiktet?,ENTY
Var är din corpus callosum?,LOC
"Vilken Broadway-musikal innehöll låten| ""If I were a rich man?",ENTY
Vem porträtterade Sherlock Holmes i 14 filmer mellan 1939 och 1946?,HUM
Varför är rymdutvecklingen så viktig?,DESC
Vad handlar barnlåten Rock-a-by Baby om?,DESC
När Superman behöver komma bort från allt| vart går han?,LOC
Hur gammal är sångaren Freedy Johnston?,NUM
Vad är ursprunget till gametofytisk vävnad?,DESC
Vad menar Aaron?,DESC
Vad är en rädsla för hår?,ENTY
Vad heter popsångaren vars sång blev temasång för ett märke av catsup?,HUM
Vad är en barrträd?,DESC
Vem påstod sig vara världens mest perfekt utvecklade man?,HUM
Vad skiljer sig mellan den röda och svarta räven?,DESC
Vad är e-handel?,DESC
Hur knyter jag slips?,DESC
Var kan jag få information om importörer av bomullstextil?,LOC
När började Spanien och Korea ambassadörsförbindelser?,NUM
Vilken typ av människor deltog i Shays uppror i Massachusetts 1787?,HUM
Vad är kromatologi?,DESC
Hur många spår finns på en krona?,NUM
Hur bildades ACLU?,DESC
Vilka är de mest sålda albumen av en artist eller ett band?,ENTY
Den näst mest populära sporten världen över är vad?,ENTY
Vad förlorar guldfisk om de förvaras i svagt upplyst eller rinnande vatten?,ENTY
Vilken kanal sträcker sig Thatcher Ferry Bridge över?,LOC
Vilken amerikan vann världsmästerskapet i körning 1978?,HUM
Vad är chansen för graviditet om penis inte tränger in i slidan?,NUM
Vilken är den högsta handen i rak poker?,ENTY
Var kan jag hitta en lektionsplan för undervisning i metriska systemkonvertering till amerikansk standard?,LOC
Vad heter Kevin Costners film om Sioux Indians?,ENTY
Vad är Kythnos| Siphnos| Seriphos och Mykonos?,DESC
Namnge en kvinnlig konståkare.,HUM
Varför finns det inga vita linjer på pro fotbollar?,DESC
Hur lång tid skulle det ta för en $ sparande obligation att förfalla?,NUM
Hur är Abigail Arcane relaterad till den skurkiga motståndaren till Swamp Thing?,DESC
Vad etablerade Wienkongressen?,ENTY
Vad är den genomsnittliga kostnaden för fyra års läkarutbildning?,NUM
Vilka skadliga kemikalier finns i insektsspray?,ENTY
Hur många spjut finns det på Kenyas flagga?,NUM
Vad sjöng Mighty Mouse alltid när han gick i handling?,DESC
Var bodde George of the Jungle?,LOC
Hur dog Bob Marley?,DESC
Vad är mäns par på ett 455-yard golfhål?,NUM
Hur stor andel amerikanska män är alkoholister?,NUM
Att ringa| 900| 740-TREE för att få ett träd planterat kostar hur mycket?,NUM
Hur många amerikanska soldater finns det i Sydkorea?,NUM
Vem porträtterade Carl Bernstein i Alla presidentens män?,HUM
Vilka är siffrorna som passar in i Fermats sista sats?,NUM
Vem var Tiny Tims far?,HUM
Vad studerar en heliolog?,ENTY
Vem var Bonnie Blue Butlers far?,HUM
Vilket schampo förhindrar eksem| seborré och psoriasis?,ENTY
Hur många amerikaner har HIV?,NUM
Var hittar jag information om utestängningsfastigheter på Internet?,LOC
Vem är Antikristus?,HUM
Vilket var det första engelska stycket som exklusivt skrevs för barn?,ENTY
Vilket Latinamerikanskt land är störst?,LOC
Vilken var de skotska kungarnas tidigare residens i Edinburgh?,LOC
Hur många spenar sportar en kvinnlig get?,NUM
Hur hög är kilamanjaro?,NUM
Vem var advokaten som representerade Randy Steven Craft?,HUM
Vilket land köper 25 procent av världens teexport?,LOC
Vilket land är ursprunget till bandet Creeps?,LOC
Vad svalde krokodilen i Peter Pan?,ENTY
"Vad är ursprunget till ordet ""svamp""?",DESC
Vilka av följande kändisar föddes inte i Philadelphia?,HUM
Hur många amerikanska soldater är utplacerade i Sydkorea?,NUM
Var är den största klockan?,LOC
Vad är varumärket för kemikalien daminoziden?,ENTY
Hur fungerar mikrovågor?,DESC
Vilken tidning betalade Ernest Hemingway 15 dollar per ord för att skriva en artikel om tjurfäktning?,ENTY
Vad är den uppskattade totala amerikanska whitetail hjortpopulationen?,NUM
Vem skrev bondens almanacka?,HUM
Vilket djur fick kunglig samtycke som ett emblem av Kanada den 24 mars 1975?,ENTY
Vilket nummer är vid klockan 12 på en darttavla?,NUM
Vilket lag vann Super Bowl 1968?,HUM
Vad är det rekommenderade dagliga behovet av folsyra för gravida kvinnor?,DESC
Vilken film dramatiserade Scopes monkey trial?,ENTY
CNN ägs av vem?,HUM
Vilket land erbjöd Albert Einstein sitt ordförandeskap 1952?,LOC
Vilken är den högsta romerska siffran?,DESC
Vilken tv-serie såg många av sina vattenmiljöer filmade vid Silver Springs| Florida?,ENTY
Vem var 1400-talets eld- och svavelmunk som fick kontroll över Florens men slutade bränd på bålet?,HUM
Hur används digitalt ljud?,DESC
Vad är AFS?,ABBR
Vem var Quetzalcoatl?,HUM
Vilket operativsystem använder IBM-kompatibla maskiner?,ENTY
Vilken fransk ledare sålde Louisiana till USA?,HUM
Vilken vik gnistrar bredvid Miami| Florida?,LOC
Hur många miles av vener finns i cirkulationssystemet?,NUM
Vilken berömd flod rinner genom Bagdad?,LOC
Hur görs bubbelplast?,DESC
Vad är Java?,DESC
Vem är Japans premiärminister?,HUM
Vilken spelare hukar i genomsnitt 3 gånger under en dubbelboll i baseball?,HUM
Vad är det vanligaste namnet i barnrim?,HUM
"Hur många ""nej"" -svar var Vad är min replik? panelen tillåten?",NUM
Vad är böterna för att ha en hund på en strand?,NUM
"Vem skrev boken ""Salomos sång""?",HUM
Var kan man hitta information om religion och hälsa| hjärnan och näring?,LOC
Namnge jägaren som alltid var efter Yogi Bear.,HUM
Vilket tv-program sjöng John Sebastian temat för?,ENTY
Vem är presidenten i den spanska regeringen?,HUM
Vem har karriärrekordet för flest major league home runs?,HUM
Vilka av följande skådespelare arbetade i New Yorks jiddiska teater?,HUM
Vem uppfann stetoskopet?,HUM
Vad är en matematisk faktor?,DESC
Hur många fyrastjärniga generaler fanns det och vilka är de?,NUM
När dog Nixon?,NUM
Vad definierades ursprungligen som en 1 miljondel av avståndet från ekvatorn till polen?,ENTY
Vilken komiker dök upp på TV-skärmen 1951 med NBC-eftermiddagsprogrammet Time for Ernie?,HUM
Hur många medlemmar är i Kaliforniens kongressdelegation?,NUM
Vad bryter ut varje timme i Yellowstone National Park?,LOC
Vilket land innehåller den högsta punkten i Sydamerika?,LOC
Vad kallas Arnold Palmers fans?,HUM
Vem gick i pension med 755 home runs till sin kredit?,HUM
Vilken konstellation representerar en jägare med klubba och sköld?,LOC
Vem utvecklade potlatch?,HUM
Hur länge praktiserade Shea och Gould juridik i Los Angeles?,NUM
Vad är det perfekta resultatet i en gymnastikövning?,NUM
Vilken grupp inkluderade Abbey Hoffman| Jerry Rubin och Tom Hayden?,HUM
Vad gjorde Jane Goodall känd?,DESC
Vid vilken ålder slutade Rossini att skriva opera?,NUM
"Vilken rysk hamn har ett namn som betyder ""Lord of the East""?",LOC
Namnge de två skådespelerske-döttrarna till John Mills.,HUM
Hur gammal var Gene Siskel?,NUM
Vad kan man göra angående snarkning?,DESC
Vilken Rocky Mountain-ås skiljer Nordamerikas floder österut och västerut?,LOC
Vem är skådespelerskan Bette Davis en gång sa att hon önskade att hon såg ut som?,HUM
Vem porträtterade The Cowardly Lion i The Wizard of Oz?,HUM
Vad behandlar en fotvårdspersonal?,ENTY
Vad är porfyri?,DESC
Vilken grind öppnades på Östra och Västberlin?,LOC
Vem var den första kungen av England?,HUM
Vad gjorde Finger Lakes i västra New York?,DESC
I vilken film hittar man nummer nio i titeln?,ENTY
Hur många kalorier finns det i sojasås?,NUM
Vem dödade Kurt Cobain?,HUM
Vem skapade monsteret i Mary Shelleys roman Frankenstein?,HUM
Vilken är planeten längst bort från solen?,LOC
Varför skiner solen bara en kort tid i Alaska?,DESC
Vilken kemikalie i rött vin är bra för hjärtat och vad exakt gör det mot din kropp?,ENTY
Hur koaguleras blod?,DESC
Hur stor är vår galax i diameter?,NUM
"Vilken produkt """"fördubblar ditt nöje| fördubblar ditt kul""""?",ENTY
När är en kvinna mest fertil?,NUM
Vilken son till en 15-årig mexikansk tjej och en halv-irländsk far blev världens mest kända grek?,HUM
Vem var den första mannen som återvände till rymden?,HUM
Vilket märke jeans erkände Calvin Klein i en intervju 1984 som han kände sig bekvämare att ha på sig?,ENTY
Vem gav Abbie Hoffman sin första dos LSD?,HUM
Vilken effekt har friktion på evig rörelse?,DESC
Vad gjorde de sju dvärgarna för att försörja sig?,HUM
Vilken 4-fot-9 skådespelerska 1984 blev den första artisten som vann en Oscar för att spela en karaktär av motsatt kön?,HUM
Vem sköt Billy the Kid?,HUM
Vad gör han nu?,DESC
Vilken mormonledare sägs ha haft 27 hustrur?,HUM
Vilket videoformat var ett alternativ till VHS?,ENTY
"Var kom termen ""69"" ifrån?",DESC
Vad är pengar gjort av?,ENTY
Vad är namnet på ett hotell i Indianapolis?,LOC
Hur många människor i Tucson?,NUM
Var ligger Melbourne?,LOC
Med vem jämförde Bush Saddam Hussein?,HUM
Vilket land var Mikhail Gorbatsjov ledare för?,LOC
Vad är den rekommenderade vikten för en 15-årig man som är 5| 6?,NUM
Vilken pelare av den holländska renässansen målade Aristoteles begrundandes Homeros byst?,HUM
Vad är det största länet i storlek i Massachusetts?,LOC
Vad heter den lysande brittiska ekonomen bakom skapandet?,HUM
Vem spelade Sally Rogers i The Dick Van Dyke Show?,HUM
Hur är det att uppleva en nära-döden-episod?,DESC
Vilken mytisk figur bär ett timglas och en lie?,HUM
Hur mycket är ett kanadensiskt tjugo dollars guldmynt från 1967 värd?,NUM
Varför spred sig inte europeiskt kolonialstyre förrän efter den första och andra industriella revolutionen?,DESC
Vilka naturattraktioner lockar flest besökare i USA?,LOC
Vilken presidentadministration utmanade amerikaner att utforska The New Frontier?,HUM
Hur många år sov Sleeping Beauty?,NUM
Hur lång tid tar det för din kropp att återställa blod efter att du donerat ditt blod?,NUM
Hur vet jag om någon verkligen är kär i mig?,DESC
Vilken av många numrerade kärl av Scotch bedömdes bäst av en expertpanel 1863?,ENTY
Vad är litteraturkritik?,DESC
Hur anordnar man en inflyttningsfest?,DESC
Vilken internationell sport kallades ursprungligen hurley?,ENTY
Vilken flod rinner genom Liverpool?,LOC
Vilken berömd brittisk skådespelare förlorade sin röst efter en operation 1966?,HUM
Vad betyder termen 3 för en tidningsredaktör?,DESC
Vilket företag tillverkar utrustning för impulshärdning?,HUM
Vilket land arbetade Kim Philby egentligen för?,LOC
Vad säger Freddy Freeman för att bli kapten Marvel Jr.?,DESC
Vilket land var Hitler kansler för?,LOC
Vad är Rona Barretts gifta namn?,HUM
Hur många år utgör ett lustrum?,NUM
Vad är nära möten av den första och andra typen?,ENTY
Vem är matematikern som vann nobelpriset för litteratur 1950?,HUM
Vilken glamorös skådespelerska är en nära vän till Dick Tracy?,HUM
Vilken Grace Metalious-roman 1956 stod på bästsäljarlistan i två år?,ENTY
Namnge de tre raserna som frigörs av Celestials i Marvel-serier.,HUM
Hur gammal är den italienska konstnären Maurizio Pellegrin?,NUM
Vilken president tog sig ut på joggingvägarna för att förbättra sin atletiska image och kollapsade nästan under loppet bärandes nummer 39?,HUM
Vad är distinktionen på Erle Stanley Gardners The Case of the Terrified Typist?,DESC
Vilken nordamerikansk stad skulle du besöka för att se Cleopatras nål?,LOC
När grundades NFL?,NUM
Var kan jag hitta en Ask En Expert-webbplats?,LOC
Vilken författar-journalist satte sitt prägel beskrivandes färgglada Broadway- och underjordiska karaktärer?,HUM
Vilken amerikansk stat har den lägsta högsta höjden på 6 fot?,LOC
Vad heter invånarna på ön Lesbos?,HUM
Vad är organisationsstrukturen för New Delhi Indira Gandhi flygplats?,ENTY
Vad är det traditionella att göra under misteln vid juletid?,ENTY
Vilken basebollstorhet gjorde lovord för Mr. Coffee?,HUM
Vilket internationellt amatörsportspel sändes för första gången 1956?,ENTY
"Vad är ursprunget till ordet ""amen""?",DESC
Vems bäbis var Sweet Pea i Popeye-serien?,HUM
Var ligger Mile High Stadium?,LOC
Vad letade Baffin| Frobisher och Franklin efter?,ENTY
Vad är limbo?,DESC
Vilken stad innehåller distriktet Hell's Kitchen?,LOC
Vilken intressant metod användes för att visa eftertexterna i de tidiga Popeye-serierna?,ENTY
Vad är stjärnorna gjorda av?,ENTY
Vilken engelsk läkare föddes den 18 januari 1779 och skapade sedan två viktiga uppfinningar?,HUM
Vem försökte Arthur H. Bremer att mörda den 15 maj 1972?,HUM
Hur snabbt måste en rymdfarkost resa för att undkomma jordens gravitation?,NUM
Vilken apostel är Taylor Caldwells Guds stora lejon?,HUM
Hur många ringar finns det på ett bågskyttemål med fem zoner?,NUM
Vilken bedövningsmedel tillät drottning Victoria att användas för födseln av sitt sjunde barn 1853?,ENTY
Vilket element från det periodiska systemet är en gas eller ett fast ämne| men aldrig en vätska?,ENTY
Vad är ett ton?,DESC
Vilken av de stora sjöarna ligger helt inom USA:s territorium?,LOC
Vad är DEET?,ABBR
Vilket företag säljer flest gratulationskort?,HUM
Vilken amerikansk stat har sagebrush som sin statsblomma?,LOC
Vad är Bernoulli-principen?,DESC
Vad är seriefotografen Peter Parkers hemliga identitet?,HUM
Vad är skillnaden mellan en affisch och ett tryck?,DESC
"I vilken sport finns det ett ""scrum""?",ENTY
Vilka är de bästa sätten att förbättra anställdas moral till låg kostnad?,ENTY
Vilken nationalitet har påven Johannes Paulus II?,LOC
Vad är falskt medvetande?,DESC
Hur påverkade den stora depressionen Japans historia?,DESC
Vilken sida ska en bowler som står inför en split 37803 slå 3-stiftet - till vänster eller höger?,ENTY
Var finns några bra utbildningsresurser för föräldrar och lärare?,LOC
Hur många israeliska idrottare dödades vid OS i München?,NUM
"Vilken är whiskeyn ""för människor som vet skillnaden""?",ENTY
När föddes Richard Nixon?,NUM
Vilket landmärke i New York City har 168 steg mot sin krona?,LOC
Var är Bulls basketlag baserat?,LOC
Vilken är den rekommenderade åldern att byta ett barn från en spjälsäng till en säng?,NUM
"Vilken Rockefeller kallades ibland ""JDR3""?",HUM
När är solen närmast jorden?,NUM
Vilka är några kemiska egenskaper hos mendelevium?,DESC
Vad är de genomsnittliga timmarna per månad som AOL-användare spenderar online?,NUM
Vem har Friz Freleng lagt till till Warner Bros. tecknade raden?,HUM
"Vad är urpsrunget till ordet ""sideburns""?",DESC
Rättegångarna från andra världskriget är kända som vad?,ENTY
Vad började 1849 när guld upptäcktes i Sutter's Mill?,ENTY
Vad är ett första världsland?,DESC
Vem var Shakespeares moriska general?,HUM
Vad är det näst högsta berget i världen?,LOC
Vilket land var Erich Honecker ledare för?,LOC
Hur smälter salt is och snö?,DESC
Vilka två japanska städer stavas med bokstäverna K| O| O| T och Y?,LOC
Vad står laser för?,DESC
Vem lärde Matt Murdock att använda sina extraordinära förmågor i Marvel-serier?,HUM
Var fick Wile E. Coyote alltid sina enheter?,LOC
Hur långt borta är månen?,NUM
Vilken berömd film- och TV-cowboy lånade ut sitt namn till en snabbmatskedja?,HUM
Vad är mandibulofacial dysostos?,DESC
Vad var anledningen till att de anglikanska och Vatikanska kyrkorna delades upp?,DESC
Vad är Butterfield 8 i Butterfield 8?,DESC
Vem cyklade berömt för att varna folket i Massachusetts att britterna skulle komma?,HUM
Vad är DTMF?,ABBR
Nämn en film som skådespelerskan| Sandra Bullock| hade en roll i.,ENTY
Vad sprängdes i Lakehurst| New Jersey| den 6 maj 1977?,ENTY
Vem befallde de franska styrkorna i slaget vid Orleans?,HUM
Var kan en individ testa en kontaktlins som brände hela ögonytan när den var ny?,LOC
Vilka länder förbinder Mont Blanc Tunnel?,LOC
Vilket olyckligt fartyg var anförd av Ernst Lehmann?,ENTY
När började Amtrak arbeta?,NUM
Hur många ben finns i människans hand?,NUM
Hur många kemiska element finns det?,NUM
Vilken öststat spirade det första kommersiella kärnkraftverket i USA?,LOC
Vilka är de tre mest befolkade länderna i världen?,LOC
Vem ledde oppositionen när Konrad Adenauer var kansler i Tyskland?,HUM
Vad är den nuvarande befolkningen för dessa länder: Frankrike| Spanien| Italien| Grekland| Österrike| Tyskland| Schweiz| Nederländerna?,NUM
Vilken färg har läppstiftet på Boy Georges vaxläppar hos Londons Madame Tussaud?,ENTY
Vad är ursprunget till godisrör vid jul?,DESC
Vad är varumärket på en kemikalie som används för att kontrollera mogning?,ENTY
Vilken havsskräck sjöng Johnny Horton om?,ENTY
Vilket är världens största kontorsblock?,LOC
Vem förvandlade allt han rörde till guld?,HUM
Vad är den medicinska termen för blodcancer?,ENTY
Vem spelar shortstop för Charlie Browns basebollag?,HUM
Vilket land kallade romarna Hibernia?,LOC
Vem var den mest kända matredaktören för The New York Times?,HUM
Hur många hundar drar en släde i Iditarod?,NUM
Vad kallas en manlig häxa?,ENTY
Hur länge stannar kokain i ditt system?,NUM
Vilka två länder utkämpade hundraårskriget?,LOC
Vem var den sista amerikanska presidenten att återinföra registrering av selektiv tjänst?,HUM
Vilka datum förekommer tjurspringet i Pamplona| Spanien| på?,NUM
Vad hette advokaten som representerade Randy Steven Craft?,HUM
Vad händer med begagnad motorolja?,DESC
Vilket är det vanligaste ordet med 1 bokstav i engelskan?,ENTY
Vilken skådespelares självbiografi är titlad Shelley: Även känd som Shirley?,HUM
Hur många färger var 1940-talets samlarobjekt som kallades en Donald Duck Rubber Boat?,NUM
Hur kom den sjunde inningssträckan igång?,DESC
Vem bodde vid stranden av Gitchee Gumee River?,HUM
Vad kom Tristan tillbaka som?,ENTY
Vilket land kommer att slå år 2 först?,LOC
Vilka färger utgör en regnbåge?,ENTY
Vilket krig kämpade Johnny Reb och Billy Yank i?,ENTY
Vem är sektionschef för vägledning och styrsystem på JPL?,HUM
Vad är Goldfingers förnamn?,HUM
Vilket torg är Londons geografiska centrum?,LOC
Vilka av följande kända personer målar inte som en hobby?,HUM
Vilken är den mest befolkade staden i världen?,LOC
Hur många kannor upptar hyllan bredvid den hukande kvinnan i Edgar Degas målning 1886 The Tub?,NUM
Vad kostar de läkemedel som används vid tuberkulosbehandlingar?,NUM
Vad betyder JESSICA?,ABBR
Vilken berömd slaktning av gangland skar i medlemskapet i Bugs Morans outfit?,ENTY
Ray Charles är mest känd för att spela vilket instrument?,ENTY
Var tillbringade Victor Hugo sin exil?,LOC
Vad handlade Nine Tailors| tv-showen från 1974| om?,DESC
Hur vet den långsträckta mannen att ett mysterium uppstår?,DESC
Vilken mat av de tre björnarna åt Goldilocks?,ENTY
Vad är Boston Kreme?,DESC
Vem ska jag ringa för att få en rundtur på New York Stock Exchange?,HUM
Hur många flygskolor finns det i USA?,NUM
Vilken amerikansk general dog den 1 december 1945 när hans jeep kolliderade med en lastbil?,HUM
Vad är ett prov?,DESC
Vad betyder Ouija?,DESC
Hur många stora nazistledare gick till rättegång efter kriget i Nürnberg?,NUM
Vilken typ av fisk är en kona?,ENTY
Vilken stat kallade Helen Keller hem?,LOC
"Vad hette regissören för filmen ""Jaws""?",HUM
Vilka åtgärder kan vidtas för att förhindra diabetes?,DESC
Vilka var de första orden på ett filmljudspår?,DESC
Vilket år är etsat på Gold Medal of Excellence från Paris-utställningen avbildad på en burk med Campbells tomatsoppa?,NUM
Vilket lands kungliga hus är Bourbon-Parma?,LOC
Vilken film spelade Jude Law i?,ENTY
Vem porträtterade WC Fields i filmen WC Fields and Me?,HUM
Hur såg ceremonitraditionerna ut under den elisabetiska tiden?,ENTY
Vilket college spelade Dikembe Mutombo basket på?,HUM
Vad är en rädsla för att gå och lägga sig?,ENTY
"Var kom ordspråket ""tumregel"" ifrån?",DESC
Varför reser ljud snabbare genom vatten än luft?,DESC
Hur mycket pengar har sultanen i Brunei?,NUM
Vilket land skulle du besöka för att åka skidor i Dolomiterna?,LOC
Vilken månads tredje helg hålls Monterey Jazz Festival?,NUM
"Vad är den ""globala ekonomin""?",DESC
Vem byggde den första framgångsrika akterångbåten?,HUM
Vad är en caul?,DESC
Vem var Hitlers propagandaminister?,HUM
Vem var den första läkaren som framgångsrikt transplanterade en lever?,HUM
Vad betyder teorin om kvantsprång i enklare termer?,DESC
Vad är en benmärgstransplantation?,DESC
Vad är skillnaden mellan en klassisk och en akustisk gitarr?,DESC
Vilken afrikansk huvudstad är namngiven efter en amerikansk president?,LOC
Vad heter ett språk som talas av Sioux?,ENTY
Vilken Medelhavsö är hem till den första Club Med?,LOC
Vad saknar ett ordentligt leende?,ENTY
Vad är en rädsla för svartsjuka?,ENTY
Var hittar man Venus flytfälla?,LOC
Vilken är den största skulpturen i världen?,ENTY
När föddes John D. Rockefeller?,NUM
Vilken byggnad byggd 18 innehåller 327 mil bokhyllor?,LOC
Vad är hembank?,DESC
Vilken William Makepeace Thackeray-roman gjordes till en film av Stanley Kubrick?,ENTY
Vem var advokaten för Randy Steven Craft?,HUM
Hur reproducerar eremitkrabbor?,DESC
Vem anses vara den största tillverkaren av fioler?,HUM
Hur stoppar man skräppost?,DESC
Vilken framtida sovjetisk diktator tränade för att bli präst när han vände sig till marxismen?,HUM
Hur länge gillar James Bond att hans ägg kokas?,NUM
Vilken amerikansk stads silhuett har Gateway Arch?,LOC
Var ligger Belize?,LOC
Vad är det vanliga namnet på ett japanskt dvärgträd?,ENTY
Vad skrev Thomas Paine?,ENTY
Vem stämde företaget Dannon yougurt för att ha använt en karaktär som heter Ron Raider för marknadsföring?,HUM
Vem var den första jockeyen som red två Triple Crown-vinnare?,HUM
Vilken Lewis Carroll-bok introducerade Humpty Dumpty till världen?,ENTY
Vem skrev Brave New World?,HUM
Vilken stat representerar Charles Robb?,LOC
Vad är vattenkraft?,DESC
Hur många människor är längre än 7 fot?,NUM
Vem skrev Osäkert i någon hastighet?,HUM
Hur många öar utgör Antigua?,NUM
Hur fungerar en kulram?,DESC
Vad orsakar rost?,DESC
Vad kallas rädslan för datorn?,ENTY
Vad är en teknik som ofta används för att upptäcka fosterskador?,ENTY
Vilken amerikansk stat har Stone Mountain| världens största massa av exponerad granit?,LOC
Vilken brittisk befälhavare gav sig över till George Washington i Yorktown 1781?,HUM
Vad enligt Kinsey Institute| är den sexuella preferensen hos fyra procent av amerikanska män?,DESC
Vem skapade World Wide Web| WWW?,HUM
Vad kallas proceduren att borra ett hål i din skalle för att uppnå ett högre medvetande?,ENTY
Vad heter presidenten för Garmat USA?,HUM
Vad heter TV-programmet| med Karl Madsen i huvudrollen| som hade San Francisco i titeln?,ENTY
Vem var ledare för det bysantinska imperiet?,HUM
Vem var den första presidenten som utsåg en kvinna som chef för ett kabinett?,HUM
Vad är splatterpunk?,DESC
Vad är xoxoxox ursprung?,DESC
Vem byggde den första pyramiden?,HUM
I vilket sydostasiatiskt land ansluter sig Wangfloden till Ping-floden vid Tak?,LOC
Vilken italiensk stad 155 arbetade Leonardo da Vinci| Michaelangelo och Machiavelli i?,LOC
Vilken färg på tennisbollar används på Wimbledon?,ENTY
Vad heter ett 2-sidigt föremål?,ENTY
Namnge ett franskt fascistparti.,HUM
Namnge den franska historiska perioden under Napoleon IIIs regering.,ENTY
Vilken film har tjänat mest pengar?,ENTY
Vad är tid?,DESC
Hur många stater har ett lotteri?,NUM
Vad är namnet på den största staden i Chile| Sydamerika?,LOC
Vad är du fast i om en haboob sprängs?,ENTY
Hur stor andel barn i åldrarna mellan två och elva ser på 'The Simpsons'?,NUM
Hur många städer finns det i Utah?,NUM
Vilket berömt köttföretag gick i konkurs eftersom det blev känt att underjorden hade sålt dem kängurukött?,HUM
Hur många besökare åker till Vatikanen varje år?,NUM
Vad är befolkningen i Mexiko?,NUM
Hur får du studslera ur tyg?,DESC
Vilken är den bästa webbplatsen för onlinespel?,LOC
"Varför är ordet ""förkortning"" så långt?",DESC
Vilket århundrade började konstens romantiska period?,NUM
Hur många mellanslag följer en period i slutet av en mening?,NUM
Vad är en tvålkaka?,DESC
Vilket år uppfördes Berlinmuren?,NUM
Vad är vikten av en tesked materia i ett svart hål?,NUM
Vad är den ungefärliga vikten för en tesked materia i ett svart hål?,NUM
Vad står MSG för?,ABBR
På vilken aveny ligger det ursprungliga varuhuset Saks?,LOC
Var äger låten Anything Goes rum?,LOC
Var låg den första djurparken i USA?,LOC
Hur långt är det från Yaroslavl till Moskva?,NUM
Vilken är aprils ädelsten?,ENTY
Vad heter den nuvarande påven?,HUM
Vem är nebbishen som är Marvels officiella maskot?,HUM
